{
  "schema_version": "0.1",
  "status": "complete",
  "inputs": [
    {
      "module": "M01",
      "artifact_path": "D:\\CodexProjects\\re_rpotocol\\data\\acceptance\\frozen-20260910\\integration\\m01\\result.json",
      "artifact_sha256": "e236f49ff1c96489ae2973f31b88270953303bb9ed90182d90d97bbb724b3ac7",
      "schema_version": "0.1",
      "status": "ok"
    },
    {
      "module": "M02",
      "artifact_path": "reports\\acceptance\\2026-09-11-abc\\run\\m02\\features.json",
      "artifact_sha256": "6f7541d10152829fe8ebf63d4e284b19cf24874643d6253acc47279f1c848b99",
      "schema_version": "0.1",
      "status": "ok"
    },
    {
      "module": "M03",
      "artifact_path": "reports\\acceptance\\2026-09-11-abc\\run\\m03\\framing.json",
      "artifact_sha256": "9a88329ec8e91d857ba4fc299f4982fee31c76e1cf64373ab7cb7dafcdad618d",
      "schema_version": "0.1",
      "status": "complete"
    },
    {
      "module": "M04",
      "artifact_path": "reports\\acceptance\\2026-09-11-abc\\run\\m04\\clusters.json",
      "artifact_sha256": "dc2525e5904581d9357739d595b4d0163b8adc85048dd18e61d4e619532b5266",
      "schema_version": "0.1",
      "status": "ok"
    },
    {
      "module": "M05",
      "artifact_path": "reports\\acceptance\\2026-09-11-abc\\run\\m05\\alignments.json",
      "artifact_sha256": "d41459777f500843afeae6e509c3b7fcdc3666b5332f2b824d2046e5d8a587de",
      "schema_version": "0.1",
      "status": "ok"
    },
    {
      "module": "M06",
      "artifact_path": "reports\\acceptance\\2026-09-11-abc\\run\\m06\\format.json",
      "artifact_sha256": "38d264c7e6d532ef3ec8f7460b6c25abe654b06a6faf4218856583e0e128d7c8",
      "schema_version": "0.1",
      "status": "empty"
    },
    {
      "module": "M07",
      "artifact_path": "D:\\CodexProjects\\re_rpotocol\\data\\acceptance\\frozen-20260910\\full-chain\\m07\\protocols.json",
      "artifact_sha256": "d38700eaa02e2e1b48ec75d900af5379de38c23b5f6ceb19a38c18a22b6d48cf",
      "schema_version": "0.1",
      "status": "ok"
    },
    {
      "module": "M08",
      "artifact_path": "reports\\acceptance\\2026-09-11-abc\\run\\m08\\0000\\recovery.json",
      "artifact_sha256": "1fee6019ca5ff86dc243100fc0af1f01aee6f0b72e29415a98c57eb9aee5f6fc",
      "schema_version": "0.1",
      "status": "ok"
    },
    {
      "module": "M09",
      "artifact_path": "reports\\acceptance\\2026-09-11-abc\\run\\m09\\flow_features.json",
      "artifact_sha256": "15f1b13ff2d1e6aca137c89ffb2ccfd79c2378f381cacc841574ecf9ac0b7e2e",
      "schema_version": "0.1",
      "status": "ok"
    },
    {
      "module": "M10",
      "artifact_path": "reports\\acceptance\\2026-09-11-abc\\run\\m10\\behaviors.json",
      "artifact_sha256": "f2fb9671285a671d001c8a31dea0865d43fee4e3f384396db23872a6acc74862",
      "schema_version": "0.1",
      "status": "ok"
    },
    {
      "module": "M11",
      "artifact_path": "D:\\CodexProjects\\re_rpotocol\\data\\acceptance\\frozen-20260910\\full-chain\\m11\\classification.json",
      "artifact_sha256": "69b256c8f938b9ae3a945951ed27030f35f597a20f0e6123a8108651fb0a2bf4",
      "schema_version": "0.1",
      "status": "ok"
    }
  ],
  "generation_mode": "deterministic",
  "sections": {
    "observed_facts": [
      "evidence-m01-33abe24df5cbad28",
      "evidence-m02-0cdca5494bffc7b4",
      "evidence-m03-ba4c4be655afd3ca",
      "evidence-m04-943ed22f475236eb",
      "evidence-m05-9a6e5b73d436bb3c",
      "evidence-m06-55c2bb6a3b3fd119",
      "evidence-m07-17508147355916ad",
      "evidence-m07-d837db017019d85d",
      "evidence-m08-ac99a096ee300743",
      "evidence-m09-2c7a111907a1d04b",
      "evidence-m10-027ffd5981f90765",
      "evidence-m11-17069fae633fd52b",
      "evidence-m11-71dbaaa88f28d15c",
      "evidence-m11-b5b3eb2fdaf7bd96",
      "evidence-m11-cdb2978e3d53a92a",
      "evidence-m11-ebd82a86598c50cf"
    ],
    "interpretations": [],
    "undetermined": [
      "evidence-m01-33abe24df5cbad28",
      "evidence-m02-0cdca5494bffc7b4",
      "evidence-m03-ba4c4be655afd3ca",
      "evidence-m04-943ed22f475236eb",
      "evidence-m05-9a6e5b73d436bb3c",
      "evidence-m06-55c2bb6a3b3fd119",
      "evidence-m08-ac99a096ee300743",
      "evidence-m10-027ffd5981f90765"
    ],
    "recommendations": []
  },
  "truncation": {
    "limit": 500,
    "included": 16,
    "omitted": 0
  },
  "warnings": [],
  "report_sha256": "2852712e4759d84b30b803bad7323bf5f3f4e1685d5743eaf8d4e951dadd4839"
}
